article_id,title,description,content,source_id,pubDate,country,link_clean
ee4b035ecb080f8237b789f2b66dcf3d,Everything you need to know about WA's proposed new environmental approval laws,"Premier Roger Cook says the environmental approvals process in WA is ""broken"", but will his government's legislation to overhaul it create a free-for-all for resources companies?","According to Premier Roger Cook, the environmental approvals process in WA is ""broken"", so his government will legislate an overhaul of how the Environmental Protection Authority functions. The reforms were announced at a business breakfast this week and were widely welcomed by the mining industry and business sector but have raised concerns among environmental groups. The Environmental Protection Authority is supposed to look at proposals for developments in WA, such as mining projects or infrastructure like ports, railways and pipelines. Its job is to examine whether the project could hurt the environment and how badly. Once it knows enough, the EPA passes the information on to the government and provides independent advice regarding the potential environmental impacts. But it is ultimately up to the government whether it follows that advice or not after weighing up other considerations, such as the economic and social impacts of the proposals. According to the government and business sector, the EPA is moving far too slowly with assessments and is scaring off potential investors, including for projects that could help the environment. Lodging objections to permits for mining activities is currently free in Western Australia, but the state government says it needs more resources and funding to meet an increase in challenges. Delivering a speech at that breakfast, Mr Cook said industry had been crying out for change. ""Economic opportunity is being placed at risk by a process that has lost touch with the realities of doing business and protecting the environment,"" he said. ""Our approvals processes were once considered the best in the world but as the scale, the complexity, and then the volume of projects has increased, our processes have not kept pace. ""We have a situation where projects that could make a difference to the world's efforts to decarbonise are getting held back. ""It's a bitter irony that our environmental assessment process is now perceived as the biggest barrier to our ambition to becoming a renewable energy powerhouse."" According to the WA Chamber of Commerce and Industry, there is up to $318 billion dollars worth of potential investment for projects in the state that are yet to receive environmental approval. Earlier this year Mr Cook ordered a short review of the EPA that found approvals processes had become ""overly complex, time-consuming, and costly"". The report itself has not been made publicly available but 39 recommendations to come from it have and the government says these recommendations have informed its planned overhaul. Mark McGowan will not endorse the Environmental Protection Authority's new carbon emissions guidelines, saying they go too far and could damage WA's economy. It is broadly accepted the EPA has faced a large workload with limited resources. The premier said this had created bottlenecks which had been made worse because there were a growing number of proposals coming in that were increasingly complex. To address bottlenecks, the government has set aside $18 million to fund the rapid deployment of additional resources for ""critical approvals"", including the use of external consultants and technical experts. That $18 million will also support the creation of a new role within the Department of Jobs, Tourism, Science and Innovation that will be given the title ""Co-ordinator General"". The co-ordinator general will report regularly to cabinet and will be tasked with making sure ""priority projects"" run smoothly. The EPA board is also set to be expanded from five members to between seven and nine members. And an EPA office space in the CBD will be established to bring it physically closer to stakeholders than its existing Joondalup base. WA's environment minister, Reece Whitby, will be given discretion to designate a proposal as carrying ""state significance"". For those projects, the minister will have the power to direct the EPA to complete its assessment within a specified time frame. ""This is intended for projects or proposals of state significance, the sort of game-changing projects that we don't want to lose to other states or our international competitors due to regulatory burden, the sort of projects that can create thousands of jobs,"" Mr Cook said. The premier said the new legislation will also allow other types of government assessments and approvals to run at the same time as an environmental assessment rather than waiting for the EPA. The government wants to make sure the EPA is very aware of the state's priorities. Built into planned changes to the Environmental Protection Act 1986 will be a requirement for the Environment Minister to issue the EPA with a ""statement of intent"", recognising the government's priorities and policies. We are yet to see what exactly a statement of intent would look like and what exactly the government's priorities for the EPA could be. But environmental groups, the Greens and one former chair of the EPA have raised concerns about the impact it could have on the authority's independence. Dr Tom Hatton was chair of the EPA from 2014 to 2020 and said it was always useful for the EPA board to be in tune with the minister of the day's thinking, but a statement of intent risked going too far. ""It seems to be in tension with parts of the act that say, for instance, 'The minister shall not direct the Chairman',"" he said. ""It could be very, very challenging, particularly in public perception of the independence of the EPA. ""Even if the EPA maintains its independence and maintains its integrity of advice, there's still that undercurrent, perhaps fair or unfair, that they've been compromised."" In September, Dr Hatton revealed he had felt pressured over emissions policy in 2019 during a phone call from then-premier Mark McGowan. WA's former environmental protection boss reveals how a phone call from Mark McGowan led to the removal tough new emissions guidelines, a decision experts say will be responsible for hundreds of millions of tonnes of additional greenhouse gases. The former chair said he feared the new reforms, especially the statement of intent, risked normalising such interactions. But current environment minister Reece Whitby dismissed suggestions there could be conflicts of interest arising from the statement of intent. ""The EPA is about providing independent evidence, but it's not independent of government, it has to appreciate the priorities and the issues that the government wants to confront and needs to confront,"" he said. ""The EPA will continue to have its independence in giving independent advice, but it'll be very aware of what the state's priorities are and what it has to make sure it delivers a decision on within a timely manner."" Mr Cook said his government would also be focused on putting a stop to environmental ""lawfare"". The premier said environmentalists were increasingly and frustratingly using legislation and appeals processes to slow down new developments and tie up proponents in court. ""Appeals exist to fix errors in the decision-making process, it is not another avenue for stakeholders to re-prosecute their ideological opposition to a project,"" Mr Cook said. ""I think most would agree that an international backpacker travelling through Exmouth shouldn't be able to appeal a proposal in the Pilbara and hold up an assessment."" Mr Cook also said he believed there was evidence of environmental groups creating division in some Aboriginal communities by influencing minority factions to challenge approval processes. ""I think it's important for all of us when we engage with Aboriginal groups, that we respect their right for self-determination, that we don't seek to find outliers that can then enhance your particular position."" Mr Cook said legislating its environmental approvals overhaul would be a priority and he hoped it would be introduced to parliament in the first half of 2024. Meanwhile, another major environmental endeavour of the state government, the ""Sectoral Emissions Reduction Strategy for Western Australia"", was also published this week. Greens MP Brad Pettitt said he was not surprised the SERS received notably less fanfare. ""The only target that's even mentioned in this document is one for 2050, when everyone in this government will be retired and no one will be accountable,"" Dr Pettitt said. Environment Minister Reece Whitby , insisting there was no need because the Environmental Protection Authority was already taking 'vigorous action'. Select "" from either the or the settings menu .",abc_net,2023-12-13 21:27:17.000000 UTC,australia,https://www.abc.net.au/news/2023-12-14/new-wa-environmental-laws-explainer-epa/103224098
541315de8c72fd926f9b2e50f2002144,How weather systems could work in tandem to deliver one of the hottest-ever summers in WA,"El Niño is tipped to bring scorching temperatures to the east, but its impact is less clear in WA. However, there's another climate driver that will bring some serious summer heat.","A scorching severe weather season is tipped for Western Australia, with a warm and dry summer expected that the bureau warns could be among the hottest on record. While many parts of the country's east have already seen severe bushfires and extreme temperatures due to El Niño, another climate factor is dominating the weather pattern in the west. The main driver behind WA's outlook is a (IOD) that developed during the past few months. Cold waters off Indonesia and warm waters off the Horn of Africa are creating a classic positive IOD pattern, which suppresses rainfall for WA and increases temperatures. The other weather phenomenon at play is El Niño, which occurs when sea surface temperatures in the central and eastern tropical Pacific Ocean become substantially warmer than average, causing a shift in atmospheric circulation. It was Peruvian fishermen, hundreds of years ago, who first noticed and named El Niño. Little did they realise they had named one of the most consequential climate drivers on Earth. This is how it works. Because El Niño occurs in the Pacific Ocean, the impact from this phenomenon will be greatest on the east coast. Its devastating effects have already been seen, as dozens of bushfires rage in parts of Queensland and New South Wales amid a warmer than usual spring. When a positive IOD and an El Niño occur together, they enhance each other and their drying effect typically becomes stronger and more widespread across Australia. For Western Australia, it means a warmer and drier outlook this summer, an extension of the bushfire season, a higher risk of heatwaves, a delay to the wet season in the state's north and fewer cyclones. WA Bureau of Meteorology meteorologist Jessica Lingard said those living in the north would be at greatest risk. ""With the delayed onset to both the monsoon and those wet season rains, it's going to be more dangerous through there with the prolonged bushfire season,"" she said. Ms Lingard warned that while there would be fewer cyclones, it did not mean they would be less destructive. ""The average for WA is around five cyclones a year, so we're probably likely to see less than that number this year,"" she said. ""But we only need one cyclone to come through and we'll see those devastating floods like we saw in January this year with ex-tropical cyclone Ellie. ""If we have a look at last year, for example, [it] was quite a quiet season across the Australian region, we only had six tropical cyclones, five of those reached a category five cyclone, so very, very powerful systems."" Perth's summer is about three to four times more likely to be in the top 20 per cent of its hottest. The South West region, which usually sees slightly cooler temperatures, is also looking at being around two to three times more likely to have a warmer than normal season. The bureau's modelling also shows the chances of minimum temperatures being in the warmest-ever 20 per cent. Northern and central parts of the state are around four times more likely to have their warmest ever nights. ""In the north, we can see that's an issue because we've got the delayed onset of the monsoon, and we've got delayed onset of those summer rainfall, so much warmer conditions as a result of having that lack of rainfall,"" Ms Lingard said. A combination of very hot minimums and maximums will increase the risk of heatwaves. ""It really is the warm nights that drive those heatwave conditions because you can have a hot day, as long as you've got a nice cool night to recover from it. ""The body really struggles when we see those really warm nights consecutively, that's what tips us into heatwave conditions."" Most of the WA coastline will be very dry from December to January, as a result of the positive Indian Ocean Dipole and El Niño joining forces. ""In both of these phases, you can see the warmer water is further away from our country,"" Ms Lingard said. ""So taking with it, that warm water, the more evaporation, the cloud, the rainfall ... leaving Australia quite dry.""",abc_net,2023-10-31 21:14:39.000000 UTC,australia,https://www.abc.net.au/news/2023-11-01/el-nino-weather-pattern-in-wa/103032024
cf15e41b0d2a5a0feb53286364986e2a,'Wind farms killing koalas': Are conservative claims about blunt-force euthanasia correct?,Conservative politicians including Keith Pitt and Craig Kelly say killing koalas with blunt force trauma is part of the plan to make way for a Queensland wind farm. But there's more to the story.,"This week, CheckMate delivers some crucial context to claims that Labor's plan to reach net zero involves ""smashing the skulls of koalas with a hammer"". We also investigate a supposedly toxic new method to stop fruit from spoiling, linked to the philanthropist and frequent target of misinformation Bill Gates. Following a recent address in which Treasurer Jim Chalmers to reach Australia's renewable energy goals, the federal government has been accused of slaughtering koalas in its quest to achieve net zero emissions. On social media, grizzly claims took flight after Nationals MP Keith Pitt used to highlight the construction of a wind farm whose environmental plan includes provisions to euthanise the iconic animal where necessary. The Liberal Party suggested federal energy minister Chris Bowen was behind the plan with reading: ""Wind farms killing koalas: euthanasia will be conducted using blunt force trauma."" On X (formerly Twitter), United Australia Party national director Craig Kelly labelled the government ""a demented cult"" that believed it was saving the world by ""smashing the skulls of koalas with a hammer"". ""Labor's latest plan to reach Net Zero involves killing koalas that get in the way of their wind turbines, by hitting the koalas with a 'hard sharp blow to the base of the skull' to euthanise them,"" . So, what's going on? The Clarke Creek Wind Farm is a major renewables project being constructed north-west of Rockhampton, Queensland. It is being built in three stages, with the expected to add 194 wind turbines and power 680,000 homes. During his interview, Mr Pitt highlighted the project's , which notes that the project may result in the loss of up to 1,513 hectares of suitable koala habitat. The 125-page document details how the site's developers must protect threatened animals such as birds, koalas and greater gliders, and minimise or offset the destruction of habitats. Also included in the plan, which was drafted and approved before Squadron Energy acquired the farm in March 2022, are details of how euthanasia will be conducted in cases where injured animals are deemed to be ""unviable"". ""Euthanasia will be conducted using blunt force trauma,"" it states. ""This is a hard, sharp blow to the base of the back of the skull with a blunt metal or heavy wooden bar."" Importantly, despite criticisms of Labor's involvement, the project and its management plan were approved under the former Coalition government of Scott Morrison. As shown by the website of the federal Department of Climate Change, Energy, the Environment and Water, the wind farm in November 2018, more than three years before Labor came to office in May 2022. Meanwhile, the project's 2023 notes that the biodiversity plan ""was submitted to the minister"" and approved on June 12, 2020. It says the latest version, dated September 10, 2021, was also provided to the then-minister. As for euthanasia, this is far from the developer's first option when dealing with koalas who ""get in the way"" of building wind turbines. According to the biodiversity plan, the project will build around threatened species habitat where possible (via ""micro-siting""), and its performance indicators include a target of ""no mortality or injury to … threatened species"". Animals must be identified via ""pre-clearance surveys"", and would be encouraged out of clearance zones through the use of ""sensitive clearing techniques"" such as tapping hollow-bearing trees, the plan states. Where a koala is identified, site developers must: avoid felling any trees that might fall near it; move clearance activities away from any koala that appears ""visibly distressed""; leave both a 30-metre ""buffer"" of vegetation around any tree housing a koala and a vegetation ""corridor"" to the nearest vegetated area; allow the koala to self-relocate; and not interfere with it unless it has been injured. ""Injured koalas are to be taken immediately to the nearest vet with wildlife capabilities or to an experienced koala carer and only handled by experienced personnel,"" the document adds. Finally, the plan states that any injuries will be assessed by a qualified ""fauna spotter"" who must seek advice from their supervisor or an experienced wildlife carer or vet before making any decision to euthanise. The guidelines in the euthanasia section of the document (D.6) can only be followed after section D.5, which contains rules on how to care for injured animals, including that: ""All animal care … must be undertaken in line with the Care of Sick, Injured or Orphaned Protected Animals in Queensland Code of Practice [2013]."" For fatal injuries, that animals should be euthanised ""by barbiturate overdose while under general anaesthesia"" or, where not practicable, by a method that causes minimal pain and suffering, such as ""cranial trauma"". In a , Squadron Energy said it has ""a zero-harm policy for native animals"" and employs wildlife officers to ""conduct assessments 24 hours before work starts and monitor and supervise work as it occurs, to prevent injury to fauna"". ""No koala has been injured or killed during construction of the Clarke Creek Wind Farm and clearing for stage one is 60 per cent complete."" In a statement, a spokeswoman for the federal environment department told CheckMate: ""The department has not received any notification of koala death or injuries from either the approval holder or any third party."" , an expert in koala habitat management and research fellow with the University of Queensland's School of Environment, told CheckMate that ""we shouldn't be planning for a catastrophic injury to any animals"" and that the euthanasia information was not ""a great look"". Dr Ellis emphasised that any euthanasia plan should state ""very clearly"" the competence of whoever was deciding on or administering euthanasia, and noted that the ""principles of adaptive management would suggest … [the plan] needs to follow the latest best practice"". Spanish firm BlueFloat Energy says it intends to resubmit its proposal for the controversial project off the Illawarra coast, which it lodged before the government declared the area designated for that purpose. In any event, the Clarke Creek project certainly isn't the first to include a euthanasia plan. Arrow Energy's 2018 for its Surat Gas Project, for example, noted that in cases where it may be ""necessary to euthanise an animal, humane procedures will be used"". While certainly less descriptive about the methods to be applied, the plan said: ""It is important to recognise that whilst some physical methods of euthanasia (e.g. stunning followed by exsanguinations) are not aesthetically pleasant, they may be humane as they ensure immediate insensitivity to pain. ""The choice of technique will be made based on the sensibilities of the animal to be euthanised rather than the sensitivities of the observer or personnel involved."" The blunt-force technique outlined in the Clarke Creek biodiversity management plan largely mirrors that contained in a published by the Western Australian government, titled Humane Killing of Animals under Field Conditions in Wildlife Management. Unfounded claims about a new spray-on product designed to prolong the shelf-life of fruit and vegetables have made their way into Australian Telegram channels, echoing scare campaigns advanced by social media users in the US. According to , Apeel Science, the invisible, edible glaze ""slows water loss and oxidation, the primary causes of spoilage"". On social media, however, the product, known as Edipeel, has been variously labelled as a ""toxic coating"" and ""Bill Gates' latest attempt to poison humanity"". Meanwhile, an Australian Telegram channel shared a post purporting to show a photo of an avocado labelled with an ""Apeel"" sticker, taken in a local supermarket. ""Poison APEEL now available at Woolworths 🤮,"" the caption read. But is it poisonous? Well, no. Claims about the spray being ""toxic"" appear to stem from social media posts and videos that point to a product safety sheet showing that ""Apeel"" contains chemicals that can cause eye damage and allergic skin reactions. The problem is, refers to an , produced by the UK-based company Evans Vanodine. An also shares the name APEEL but is again not related to the food product. According to Apeel's US : ""Edipeel is composed entirely of a mixture of food grade glycerolipids derived from edible plant oils."" Specifically, it is made from ""the food additive mono- and diglycerides of fatty acids"", which in Australia is used in foods . by Food Standards Australia and New Zealand (FSANZ) has estimated that, were Edipeel to be used in Australia, the additive would represent 0.6 per cent of the average Australian's ""mean total fat intake, which was within normal daily variation"". As for whether local avocados are already being sprayed with the product, the label pictured in the aforementioned Telegram photo refers to a ""California Avocado"". These are not available in Australian supermarkets, with recent analysis by industry peak body Avocados Australia showing that avocados are currently only imported . Apeel's website also shows that Edipeel . Meanwhile, such as InfoWars host Alex Jones have criticised the product due to the involvement of Bill Gates — who has at various times been accused of planning to or . Certainly, the Bill and Melinda Gates Foundation provided two grants to Apeel, in and . But in separate statements , the foundation said these grants had concluded, while Apeel said the foundation was no longer an active investor in the company. Got a fact that needs checking? Tweet us or send us an email at",abc_net,2023-11-09 21:00:34.000000 UTC,australia,https://www.abc.net.au/news/2023-11-10/fact-check-euthanising-koalas-clarke-creek-queensland-wind-farm/103085452
