article_id,title,description,content,source_id,pubDate,country,link_clean
4feb6edc6edcf1a17b9a97ed7d06b543,Like a 'wheelie bin left in the hot sun': Queensland government launches legal action against garbage facility,"The Queensland government has launched legal action against a waste facility to stop it from carrying out odour-producing activities, after locals claimed it was making them sick.","The odour was like a ""wheelie bin left in the hot sun"". Sarah Waite had to close up her house and run the air conditioners to keep the place cool and stop the smell. ""It is a repulsive smell that you cannot get used to and it is difficult to persist with if you are outside,"" she said. Leonardo Monaco said the smell was so dire that it made him feel ""nauseous"" and it triggered headaches. ""If I had known about the unbreathable smell … I wouldn't have bought the house,"" he said. These are small sample of the more than 70 witness statements the Queensland government is using to try and stop a multi-million-dollar NuGrow garbage facility, south-west of Brisbane. against the Swanbank site, lodged on Friday by the Department of Environment and Science (DES) in the Planning and Environmental Court. If the application succeeds, DES will be able to limit certain aspects of NuGrow's operations, including receiving highly odorous waste that has ""a high potential to generate odour and impact the community"". Thousands of complaints have been made about a foul stench, often compared to cat urine and rotten eggs, coming from this industrial site. Infringement notices have been issued — but not about the smell. The department said it had gathered first-hand accounts from community members, detailing their experience of a noxious ""sweet fermented garbage"" smell coming from the site. ""Odour issues being experienced by the Ipswich community are unacceptable,"" a DES spokesperson said. ""This civil proceeding is the result of the department's enhanced compliance activities and meticulous investigation in the area, demonstrating our strong commitment to holding non-compliant operators to account."" Earlier this month, for breaching the Environmental Protection Act. Over the past five years, more than 25,000 complaints have been made to the state government about the odour across the Ipswich region. In 2018, the state government allocated $2.5 million to an Odour Abatement Taskforce to investigate the smell in response to community anger. In September this year, Queensland's Chief Health Officer John Gerrard said the region's air quality was ""below levels known to be associated with disease"" following growing calls for a public health inquiry. Others have called for a compensation scheme to be established for those seeking medical treatment in relation to the smell. ""When driving around our area, I am forced to keep the windows up on the car when the foul odour is present,"" Ms Waite, who lives in Flinders View, said in a statement provided to court. ""We experience the disgusting smell intermittently at my home a couple of times a week."" Locals claim the rotten egg-like smell is causing illnesses and ailments, including rashes, nausea, vomiting and migraines, with some needing hospital treatment. Kellie Bryan said the odour had a ""sweet tang"" that caused her to immediately start ""coughing and gagging and then vomiting"". She said the odour had increased in intensity in recent months and could last up to 12 hours at her Redbank Plains residence. ""The odour has absolutely affected me mentally and psychologically,"" she said. ""When the odour is at its worst stench, I instantly feel defeated, horribly sad, distressed, anxious."" George Baxter, who has lived at Flinders View for over 13 years, said he had stopped gardening due to the fumes. ""When we first moved here there was no bad odours … over the years, I have noticed that the smell is worse after it rains,"" he said. ""[It's a] combination of compost waste and dead animal."" NuGrow did not respond when asked for comment.",abc_net,2023-12-01 08:35:17.000000 UTC,australia,https://www.abc.net.au/news/2023-12-01/qld-government-legal-action-garbage-facility-bad-smells-swanbank/103179740
e446a843338a2975cfabb23f5f713060,"This popular aquarium plant can be bought for $5, but did you know it's illegal?","Biosecurity experts are warning the aggressive, invasive weed acts like a blanket over water, dominating everything and reducing oxygen for aquatic animals.","Biosecurity experts are warning an aggressive, invasive weed available for sale online for as little as $5 as an ornamental aquarium plant is spreading and causing concern for the state's waterways. Amazon frogbit can be purchased online from producers within Australia and is promoted as an aquarium feature plant, despite being listed as prohibited matter in New South Wales. Tim Low from the Invasive Species Council said the ""choking water weed"" could multiply quickly and grow over an entire body of water. ""It acts like a blanket over water, dominating everything and reduces oxygen for fish and aquatic animals,"" he said. ""The plant's horizontal growth pattern helps it grow fast."" Mr Low said it could cause very ""dramatic"" and ""serious"" changes to an aquatic system, with the council ""afraid"" of its continued spread. ""Online trade has made it difficult to regulate the sales of frogbit, so people buy it for ponds unaware it's illegal,"" he said. ""There is not enough investment in weed control in any jurisdiction in Australia; the number of ornamental plants that are being brought into cultivation is staggering and everyone is worried about the capacity of budgets to keep up."" The weed was regulated as prohibited matter in NSW in 2015, with possession, movement and sale of the plant made illegal under the Biosecurity Act. Its first known naturalised discovery was near Forster on the Mid North Coast in 2017 and since then it has spread to the Greater Sydney, Hunter, South East, North Coast, Northern Tablelands, Central Tablelands and Western regions. In September and October two new detections were found on the South Coast at Bomaderry and Corrimal. Alicia Kaylock, Local Land Services weeds coordinator for the South East, said the biggest issue with the weed's spread was a lack of awareness. ""These kinds of things are often sold online as floating pond plants and [people] want to grow it in their fish tank and they don't know they are doing the wrong thing,"" she said. ""Part of what we are trying to do with these infestations is educate the public that this is not a species you should have, and if you do have it at home, please contact your local council and they can help you dispose of it safely."" Tony Martin from the Illawarra District Weeds Authority said illegal dumping was the main cause for frogbit's spread. ""People dump the weeds thinking it's plant matter and it can spread through floods,"" Mr Martin said. He said the weeds needed to be monitored for years after they were found and treated. ""The seeds can last up to three years,"" he said. The Department of Primary Industries recommends residents use the for information on frogbit and its identification. Studies into how long the weed can survive in ocean waters are being undertaken at Western Sydney University. Frogbit has not been raised in the current invasive species management review.",abc_net,2023-10-20 22:36:40.000000 UTC,australia,https://www.abc.net.au/news/2023-10-21/amazon-frogbit-invasive-weed-choking-waterways/102952870
c60229b6d82349661c2db13b63138c32,Why Australia won't back Pacific's calls to urgently phase out fossil fuels,"Australia's climate change ambassador says the federal government cannot yet back the Pacific's call to rapidly phase out fossil fuels because it's grappling with ""complex"" and ""difficult"" issues thrown up by decarbonisation.","Australia's climate change ambassador says the federal government cannot yet back the Pacific's call to rapidly phase out fossil fuels because it's grappling with ""complex"" and ""difficult"" issues thrown up by decarbonisation. Pacific Island countries have been pressing Australia to sign up to the ""Port Vila call"" for a Just and Equitable Transition to a Fossil Fuel Free Pacific, saying it's a crucial step to avoid catastrophic environmental damage from climate change. Earlier this month Pacific Island leaders agreed to ""transition away from coal, oil and gas"", but Australia and New Zealand succeeded in watering down some language in the final Pacific Islands Forum communique, which says only that leaders ""aspire"" to the Port Vila call. The final statement also says the leaders acknowledged that the pathway to the phase out ""is not immediate nor is it one-size fits all"". Climate change ambassador Kristin Tilley said while Australia ""absolutely"" backed several elements of the Port Vila call, there were ""some parts of it that we're not in a position to currently support"". ""It's not … that we're saying, 'No that's it, end of story, end of conversation,'"" she told the A Little Less Conversation climate podcast, which is produced by the Australian Council for International Development and the World Wildlife Fund. ""But these are complex, difficult issues around the urgent phase out of fossil fuels, and in particular, fossil fuel supply."" Australia remains one of the world's major fossil fuel producers, with a recent paper by the Climate Council finding it exports nearly three times as much fossil fuels as the United Arab Emirates, which is about to host the COP climate talks in Dubai this week. Ms Tilley said that while Australia was intent on rapidly accelerating the shift to renewables in its own economy, it could not simply cut off supplies of coal and gas to countries like Japan and South Korea without endangering their ""vitally important"" energy security. But she told the podcast that Australia's fossil fuel exports to those countries would inevitably fall as their governments shifted to renewable energy sources in line with their own net zero targets. ""The strongest levers that can accelerate that shift from switching the supply of fossil fuels that we send overseas to becoming renewable energies will be the decarbonisation pathways of the countries that import those fossil fuels, and that use them,"" she said. ""[And] while it requires actions by those countries that are importing or buying our fossil fuels, we are working with them … through our bilateral energy trade to both decarbonise the supply of our energy commodities to them, and [on] their own domestic decarbonisation."" The ambassador said Australia also needed to understand ""decarbonisation pathways"" in countries like Japan and South Korea to get ""clarity"" on how they would shift its own energy exports. But the ambassador's comments have been criticised by climate change advocates, including those behind the push for a fossil fuels phase out. ""The Australian government is using a drug dealers defence to try blame other countries for their approvals of new coal and gas projects — saying they'll keep exporting their product as long as there is a buyer,"" said the campaign director of the Fossil Fuel Non-Proliferation Treaty Initiative, Michael Poland. And Dr Wesley Morgan, senior researcher at the Climate Council said Australia could not avoid the hard realities of climate change. ""The science is unequivocal: any new fossil fuel project threatens our global climate target of limiting warming to 1.5°C,"" he said. ""Australia needs to stop adding fuel to the fire. That means stopping the approval of new coal, oil and gas projects, and getting behind a global commitment to the managed phaseout of fossil fuels."" It comes as Climate Change Minister Chris Bowen prepares to travel , where small island states are vowing to ramp up pressure on major emitters to keep key climate goals within grasp. Australia wants to co-host the 2026 COP meeting with Pacific Island nations, but is vying for the slot with Türkiye, which has also put up its hand for the event. However, the 2026 host is unlikely to be selected or announced in Dubai, in part because of a deadlock over which European country should host COP next year. Prime Minister Anthony Albanese has announced a new pact with the low-lying island country of Tuvalu, allowing residents facing displacement from climate change the ability to resettle in Australia. Ms Tilley said that Australia was still engaged in negotiations with a host of countries to see if it could lock down the event in 2026. ""This is quite interesting, because ministers say – well, what's the process to resolve this, and, indeed, there isn't a formal process,"" she said. ""We do have a competing country, so we are just working through the process on how we come to an agreeable outcome."" But she stressed that if Australia did win hosting rights, then the event would be held in ""genuine partnership"" with Pacific Island nations. ""Without question, we want this to … look and feel like a Pacific COP, so that international people who come say, 'Wow! I got the sense of Pacific perspectives that I didn't previously have,'"" she said.",abc_net,2023-11-30 03:44:34.000000 UTC,australia,https://www.abc.net.au/news/2023-11-30/climate-change-ambassadors-comments-pacific-fossil-fuels/103168048
7a16f47c4a2c9ad82329c19b9d1f9e7d,Reggie wants to see change for his community. He hopes an underground toxic waste storage facility will help,"The ""globally significant"" project will store up to 400,000 tonnes per annum of toxic waste, including low-level radioactive material from Australia and overseas.","Native title holders have voted to support the construction of a controversial toxic waste storage facility about 120km south of Alice Springs after 12 years of consultation. Developers Tellus Holdings said the Chandler Project would be the first underground salt mine and deep geological waste repository of its kind in Australia. The proposed facility will be built within a 500-million-year-old salt bed on Maryvale Station, 25 kilometres south-west of the remote Aboriginal community of Titjikala. The project has been given approval to receive up to 400,000 tonnes per annum of hazardous material over 25 years, from both Australia and ""strategic Pacific partners"" overseas. This would include low-level radioactive waste and naturally occurring radioactive materials. Tellus said the waste would be stored in an underground vault, about 850 metres below the surface, within the vast salt bed. ""The scale of this project is unlike anything else being built in the world, particularly how remote it is,"" chief executive Nate Smith said. ""The unique part about Chandler is the geology. It has an extremely deep, stable, thick bed of salt, which is perfect to create that scientific natural halt to make sure that waste is permanently isolated."" Last week, native title holders gathered to vote in favour of the project, with many hoping it would bring a much-needed economic boost to their communities. ""Some of the older people think it's dangerous. But I think it would be better to go ahead,"" native title holder Reggie Kenny said. ""The salt, nothing's going to come out of it once they put it in there."" Mr Smith said the low-level radioactive material would include medical waste, X-ray imaging and cancer treatment, as well as rare earths processing and water treatments. ""It's in hospital basements, it's sitting on the sides of curbs, it's sitting in on remediated mine sites,"" he said. ""The question is, does it continue to sit in places where it can harm waterways in the community? Or does it go to truly one of the safest places on the planet?"" While Tellus would not confirm a dollar figure, Mr Smith said the construction of Chandler would likely be up to ""10 times"" the cost of Sandy Ridge, an open-cut mine and hazardous waste storage site developed by Tellus in WA. He said this made it essential for the Chandler facility to accept waste from overseas, as there was ""no way"" the domestic market could support the cost. Despite widespread support, some native title holders, like Titjikala resident Elaine Shilling, were concerned the facility could impact local water sources. ""Not good, it's going to affect us, all of us,"" she said. ""We're just worried about water because we've got a lot of kids, a new generation. I don't know what's going to happen."" But Mr Smith claimed there was nothing to worry about, as the vault would sit about 500m beneath the lowest known aquifer. Tellus is also required to provide the EPA with an independent, peer-reviewed water management plan before any approval or decisions are made on the project. However, Australian Conservation Foundation nuclear analyst Dave Sweeney said the project had ""serious implications"" and required ""a high level of scrutiny and testing"". ""Low-level waste does not necessarily mean low-level risk,"" he said. ""Some low-level waste has short activity and danger periods but some requires isolation from people and the wider environment for 300 years."" Mr Sweeney said he was concerned about the ""potential for future project creep and the extension of materials deemed acceptable"" at any future facility after the Chandler Project. For more than a decade, the Central Land Council (CLC) has been facilitating consultation between Tellus and native title holders about the Chandler Project. CLC chief executive and Arrernte man Les Turner said the project was initially proposed solely as a salt mine but had gradually changed over the years. ""We commissioned independent advice on the radioactive waste component, and a lot of that's been provided to the native title holders ... and overall, the authorisation was provided,"" he said. As Maryvale Station is a pastoral lease, native title holders do not have veto rights, only the right to consultation. But Tellus claimed if native title holders had not given approval, the project would not have gone ahead. Mr Smith said, from here, Tellus would work to ""build trust"" with the broader Alice Springs community, and start approaching potential clients. He said, from there, construction could take up to five years and would aim to drive jobs in the NT for ""the next 100 years"". Many native title holders like Mr Kenny hoped the project would have lasting impacts for local Aboriginal communities. ""This mob here has given us the time to think and do everything. That's what we want and they want,"" he said. ""We want it to go ahead.""",abc_net,2023-11-03 21:16:44.000000 UTC,australia,https://www.abc.net.au/news/2023-11-04/native-title-holders-support-toxic-waste-facility-alice-springs/103048570
49eefb865d2495e13f21f44c0089071a,Inquiry seeks tighter leash on state-run projects for Basin Plan bill,"As the federal government's proposed changes head to debate in the Senate, a committee has backed the use of buybacks to meet recovery targets, and called for more scrutiny of water-saving projects, and greater First Nations involvement.","A Senate inquiry into the federal government's proposed changes to the Murray-Darling Basin Plan has supported the legislation but recommended amendments that boost the plan's transparency and accountability. Key points The bill extends the deadline for state-run projects that offset environmental water recovery from the basin's irrigators by using engineering works to deliver the same environmental outcomes, and allows more time to recover the additional 450 gigalitres of environmental water. It also gives the federal government more scope to purchase water directly from irrigators to meet the basin plan's water recovery targets. While the bill passed the lower house without amendments, the Senate Environment and Communications Committee report released this morning has recommended amendments that tighten the leash on how states manage the offset projects, and how the commonwealth will assist the communities it buys water from. The committee has also called for greater participation from First Nations groups living in the basin. The legislation, called the Water Amendment (Restoring Our Rivers) Bill, is due before the Senate by the end of the year, with the government requiring the support of either the Greens or Coalition senators to pass it. Under the current legislation, the $13 billion Murray-Darling Basin Plan requires its 2,750GL water recovery target met by the middle of next year, something the Murray-Darling Basin Authority and Productivity Commission warned was not possible. A part of that overall target, 605GL, was to be met through projects that deliver the same environmental outcomes as purchasing the water from irrigators. The projects were required to be completed by June 2024, however a number of them, equating to between 190GL and 315GL, are behind schedule or barely started. The federal government's legislation gives basin states until December 2026 to either finish the projects or come up with new projects. But the Senate committee's inquiry said the government should go further, demanding unviable projects be scrapped, and banning new projects from being added, something the Greens were calling for. ""Noting these significant risks, the committee is of the view that no new projects should be allowed to be proposed,"" the report says. The committee's report backs in the long-standing approach of the basin plan, to recover water toward the targets and see environmental benefits flow on from the river having more water. But a dissenting report from Coalition senators argues that enough water has already been recovered for the environment, and that greater environmental outcomes could be achieved by addressing individual problems like cold-water pollution downstream from dams, and installing more fish ladders across basin rivers. During a two-day hearing held last week, the committee heard evidence that previous voluntary sales of water from irrigators to the federal government had led to negative social and economic outcomes in basin communities. These included population decline, business downturn, school shutdowns and job losses in smaller regional irrigation communities. But the committee sided with submissions it received that said time to implement the plan was running out, and ""there was an urgent need to recover the agreed volumes of water for the environment"". While the inquiry report acknowledged water buybacks did affect communities, it ultimately supported the view that buybacks were a more cost-effective recovery tool than infrastructure projects. However the dissenting report from Coalition senators recommended keeping the existing 1,500GL cap on water buybacks, which has not been met, and excluding them as a tool for recovering the 450GL. Coalition senators also recommended keeping a socio-economic neutrality test on water recovery toward the 450GL, which requires governments to prove that the method they're using to recovery water has no negative impact on communities. The inquiry report differed in this view, by flipping the onus of proof onto to communities, recommending they demonstrate the extend to which water recovery has affected them in order to receive assistance funding from the federal government. Governments, legal experts, industry and environmental groups all called for more incorporation of First Nations values and interests in management of the basin's water resources. The report recommends including the principles set out in the United Nations Declaration on the Rights of Indigenous Peoples in the water act. The federal government has admitted it gave little notice to irrigation communities along the Murray River about information sessions this week on controversial water buybacks as part of the Murray-Darling Basin Plan. First Nations groups have been highly critical of the lengthy rollout delay of a $40 million funding package, announced in 2018, which was supposed to ""allow [Indigenous Australians] to economically participate in water and ensure that they get not only economic, but also cultural outcomes"". So far, none of that funding has been spent, and its purchasing power has been degraded by the rising cost of water rights. The Senate committee says the federal government should ""consider additional funding"" for the program.",abc_net,2023-11-10 04:19:09.000000 UTC,australia,https://www.abc.net.au/news/rural/2023-11-10/murray-darling-senate-inquiry-more-offset-project-scrutiny/103084420
