article_id,title,description,content,source_id,pubDate,country,link_clean
5c8ba9a8fd1fd2e1dc37f4aa86bff453,Inside the weather death data at the heart of the climate change debate,The world has seen temperatures briefly rise to as high as two degrees above pre-industrial temperatures for the first time ever.,"Hot weather is becoming more common than cold, but is that as bad as we are led to believe? The Bureau of Meteorology and CSIRO both say that “extreme heat has caused more deaths in Australia than any other natural hazard.” Yet other leading scientists suggest it is cold that is more deadly for Australians. I’ve investigated the arguments and its importance in the climate change debate. in the Lancet a couple of years ago found that deaths during cold weather were much more common than heat-related deaths. In the 20 years from 2000 to 2019 they found that approximately 16,684 Australians died during cold spells compared to 2,640 in the heat. This is close to six times as many deaths related to cold weather as opposed to hot, with the heat findings . If you look at thing globally, the results are even more striking with close to nine times as many excess deaths during cold weather as opposed to hot. Meanwhile, the Australian Institute of Health and Welfare (AIHW) have recently released a showing the impact of extreme weather events on human health. In this they found that heat was the biggest killer with almost 300 deaths in the decade to 2021. Cold was a little behind with just 242 deaths in ten years. One of the main reasons for the stark difference in the results is the way the numbers are counted. BoM, CSIRO and AIHW all focus on extreme weather events – only looking at small regions with extreme hot spells and cold spells and its direct impact on health. On the other hand, the Lancet study, and others like it, have a lower threshold for hot and cold weather that they term “non-optimal temperatures” and they look at “excess deaths”. Essentially, they include many more days for which heat and cold play a role in human health, and they look at all deaths rather than those specifically related to the weather. They are therefore showing something closer to the impact of the seasons on human health rather than extreme weather. In Australia we know that many of our illnesses are seasonal, such as influenza and the cold. The latest research also suggests that COVID follows a similar seasonal pattern. Professor Andrew Wilson from the Menzies centre told the ABC that ""the people who are most susceptible to deaths during these (cold) periods are the people who are most susceptible to deaths at other times; that is, people who have pre-existing diseases"". There is strong evidence that both sets of studies and organisations are accurate. Colder weather brings in the seasonal illnesses and the greatest number of excess deaths. At the same time extreme heatwaves are more deadly than extreme cold events. Globally, temperatures are rising at a rapid rate. 2023 is set to be named the hottest on record – close to 1.5C hotter than pre-industrial temperatures. Last week the world registered its first two days above 2C. As temperatures rise extreme heatwaves are becoming much more common, but cold weather is harder to find. Scientists are still debating whether the number of heat deaths will be offset by the decreasing cold deaths. Most studies suggest that heat deaths are rising faster than cold deaths are decreasing. However, many of these fail to account for the ability of humans to acclimatise to heat both physiologically and technologically (eg air conditioning). In a of the research, Patrick Brown from John Hopkins University suggests that increasing heat deaths will be mostly countered by decreasing cold deaths, but more research is needed. Over the past 20 years, the term “global warming” has become much less common than “climate change”. This is because the changes occurring on our planet are more complex than just some extra heat – and the human impact of the heat is smaller than many other factors. According to the almost half of the world experienced drought during the past decade compared to just 18 per cent during the 1950s. The Lancet also said that “heatwaves and droughts in 2021 was associated with 127 million more people experiencing moderate or severe food insecurity compared with 1981-2010, putting millions of people at risk of malnutrition and potentially irreversible health effects”. It is widely believed that these problems will continue to get worse across much of the world as rainfall patterns change. The greatest impact on future generations is expected to be inevitable sea level rise. This year’s said that “in the Earth’s past, a 1.5C global temperature resulted in sea levels six-nine metres above today”. More than 400 million people live within five metres of the current sea level. Researchers believe that if temperatures continue to rise unabated, sea levels should rise to about one metre by 2100. Even a 2C rise in temperatures is forecast to eventually lead to sea levels of 12 to 18 metres – something that would put many cities and towns underwater in the centuries to come. There are a range of other global impacts from humanity’s experiment with the world’s climate, but these are two of the most pressing. The question for humanity is how we respond to the seemingly endless parade of research and warnings about our changing climate.",skynewsau,2023-12-02 19:00:00.000000 UTC,australia,https://www.skynews.com.au/insights-and-analysis/inside-the-cold-vs-hot-weather-death-statistics-at-the-heart-of-the-climate-change-debate-as-the-world-hits-new-warming-record/news-story/22bf42316e1eb1c5dba4afcba7709994
e297a5c3c61ea06716d519c260a61daa,Queenslanders hit with serious health warning ahead of heatwave,Residents of South East Queensland are being advised to heed a range of precautions to avoid suffering from heat-related illnesses during the next three-day period of severe heatwave activity.,"The Bureau of Meteorology (BOM) has forecast extreme heat conditions across the region for Friday, Saturday and Sunday, with temperatures likely to range from the mid to the high thirties, which will begin developing from Thursday night. A broad area of the southeast falls within the weather target zone, including the Brisbane Metropolitan Area, Burketown, Beaudesert, Boonah, Caboolture, Caloundra, Doomadgee, Ipswich, Normanton, and Redcliffe. Queensland Health identified the high temperatures would not simply cause discomfort, but also pose serious risks of many heat-related illnesses to the community, as it urged people to be watchful for all symptoms. “Signs of heat stress can include rising body temperature, dry mouth and eyes, headache, shortness of breath or vomiting,” Chief Health Officer Dr John Gerrard said. “Signs of heat stroke, which is a more dangerous condition, can cause heat rash, muscle cramps, dizziness, nausea, vomiting and seizures. “Urine colour is a key indicator: clear to light straw is good, dark or gold indicates dehydration.” Dr Gerrard added that although Queenslanders were accustomed to typical warm conditions in the state, the dangers of prolonged heat with “minimal night-time relief” could often be overlooked. Among the protective measures, the public has been advised to continue to hydrate by drinking plenty of fluids and cool water, while avoiding all hot or sugary beverages, and alcohol. Those without access to home air conditioning should seek cool community spaces including shopping centres, libraries or swimming pools during the daytime, and also try physical cooldown techniques like soaking feet in cool water and wearing a wet bandana around the neck. All strenuous activity and exercise have also been advised against, but Dr Gerrard said “if it’s unavoidable”, the early morning hours before 7am is the recommended time to go. “Everybody can be at risk of heat-related illness, but infants, the elderly, pregnant and breastfeeding women, and individuals with pre-existing medical conditions are especially vulnerable,” he said. “Additional risk factors include working outdoors, taking certain medications, having alcohol or other drug problems, having disabilities or mobility limitations, and being physically active. “I would urge everyone to prepare, be mindful of their health, and check on loved ones and neighbours during this period.” The hours between 10am and 3pm are expected to be the hottest parts of the day. BOM will issue daily weather updates relating to the heatwave conditions, with the next one to come at 3pm (EST) on Friday.",skynewsau,2023-12-14 08:19:23.000000 UTC,australia,https://www.skynews.com.au/australia-news/weather/alcohol-outdoor-work-exercise-among-list-of-things-to-avoid-as-severe-heatwave-to-grip-south-east-queensland-this-weekend/news-story/0230cbaca3b263ad5b7231a305864cd3
1bfc4b3e6c763b798db1b1d94e87a1cf,Hospital under threat as emergency fire rages,A hospital in the NSW Hunter Region is standing by in case it needs to be evacuated as out-of-control bushfires threaten communities nearby.,"The NSW Rural Fire Service (RFS) was on hand to defend Kurri Kurri Hospital, at Kurri Kurri, between Cessnock and Newcastle, after fast-moving scrub fires broke out about 3pm Thursday in Abermain. The small regional hospital has 57 beds. Three separate fires joined and at the time of writing are threatening the suburbs of Abermain, Kurri Kurri, South Weston, and Pelaw Main, which are all subject to an emergency bushfire warning. The latest RFS update said people in the area of Pelaw Main, South Weston and Boundary St, Kurri Kurri are at risk. “Seek shelter now or as the fire approaches to protect yourself from the fire. It is too late to leave,” the warning reads. “If you are in the area of Cessnock Road, Charles Street, York Street, Ridley Street, William Street and Hebburn Road, in Abermain, and your plan is to leave, or you are not prepared, leave now. Leave now in a northerly direction if the path is clear. “If you are in the area of Bromage Road or Averys Lane, prepare now.” Weston resident Leslie Colecliffe told the Newcastle Herald she could see the flames from her back fence. “I’m s**t scared, I don’t know where I’m going but I’m leaving,” she said, packing her six dogs into a car before she planned to flee. While another resident, Ros Flynn, spoke to the paper after she had evacuated. “I don’t know if my house is still there,” Ms Flynn said. “When I left it was lapping the fence across the road. We’ve had fires before but nothing like this.” The most up-to-date information can be found on the . Originally published as",skynewsau,2023-12-14 08:35:00.000000 UTC,australia,https://www.skynews.com.au/breaking-news/hunter-valley-hospital-threatened-as-emergency-bushfire-rages-nearby/news-story/b44828096d0e32b309899caa689bde36
5de6e9e7ac218db7736ca102634dcfd5,"Suspicious bushfire tears through 3,000 hectares of national parkland",Police are investigating a suspicious bushfire that tore through a parkland in New South Wales’ Mid North Coast.,"Emergency services were called to McGuires Crossing Road at Belmore River, east of Kempsey, about 4pm on Tuesday last week following reports of a bushfire. Firefighters are still battling the flames, which has been brought under control after it burnt through 3,000 hectares of bushland in the Hat Head National Park. “There are no current threats, and the fire remains at Advice level. No injuries have been reported,” NSW Police said in a statement. Detectives from the Financial Crime Squad’s Arson Unit begun an investigation into the circumstances, which police believe to be suspicious. Officers are also probing whether the fire is linked to a number of blazes that were alight between 6am to 8am on the same day at Lighthouse Road at Racoon, Maria River Road at Crescent Head, and Crescent Head Road at Crescent Head. “As inquiries continue, detectives are keen to speak with the driver of a white Nissan Patrol tabletop utility, with a broken taillight, which was seen in the area about 3pm that day,” NSW Police said in a statement. Police are appealing to the public to come forward with any information that may assist in investigations. There are 53 blazes, 13 not contained, burning across New South Wales as of Tuesday morning, with most of the state warned to be ready to act with a high fire rating in place. The Mid Coast, Far Western, Southern Riverina and Southern Slopes are on alert with a moderate fire warning as residents are urged to plan and prepare. Anyone with information about the suspicious Kempsey bushfire is urged to contact Crime Stoppers on 1800 333 000 or .",skynewsau,2023-10-23 21:58:40.000000 UTC,australia,https://www.skynews.com.au/australia-news/crime/police-investigate-after-suspicious-bushfire-tears-through-3000-hectares-of-hat-head-national-park-in-nsw-midnorth-coast/news-story/9140b0b58389e50355e34586c3e59f12
c1d6ca0175072f39bb02b0424a6ee7a3,Ticking timebomb as NSW RFS falls behind on its hazard reduction targets,"New South Wales is a “ticking timebomb” according to frustrated members of the state’s Rural Fire Service with data showing the agency is tens of thousands of hectares behind its crucial hazard reduction target, scaring volunteers.","New South Wales is a “ticking timebomb” according to frustrated members of the state’s Rural Fire Service with data showing the agency is tens of thousands of hectares behind its crucial hazard reduction target, scaring volunteers. Sky News Australia can exclusively reveal the RFS has “hazard reduced” around 60,000 hectares – roughly 20 percent - of its 300,000-hectare target at almost the half-way point of the financial year. It hoped to catch up after summer when the weather cooled in April, May and June. Additionally, Sky News has also seen a secret document which showed multiple tracks of land rated “extreme” and “high risk” were still to be hazard reduced ahead of dangerous spikes in temperature over Christmas and New Year. The list detailed more than six-thousands hectares of land in the fire prone Hawkesbury region, north - West of Sydney. One location identified as extreme appeared to have been first approved for hazard reduction eight years go only to repeatedly miss out. There is a further 2,500 hectares of bush rated as “very high” danger to the community, also still undone. The extensive damage caused by the intensity of the 2019-20 Black Summer of bushfires has also exacerbated the danger to residents living in rural areas. With the ‘crowns’ or canopies of large gum trees destroyed, the forest floor has been exposed to years of sun and rain, allowing “impenetrable” scrub to grow back, increasing fuel loads to dangerous levels. “If you double the fuel, you quadruple the intensity of the fire,” said Volunteer Fire Fighters Association President, Brian Williams. Williams predicts future blazes will be even “bigger and worse” than four years ago, unless hazard reduction practices drastically change. “Experienced firefighters are now starting to get very concerned at the dangers,” he said. “The consequences of losing a crew or more than one crew is an ever-increasing factor in our decision-making process.” The five-decade veteran showed this reporter an area of dense scrub along the Bells Line of Road in Bilpin. The major arterial road carves its way through the Hawkesbury and over the Blue Mountains linking rural towns with metropolitan Sydney. “Four years after the Gospers Mountain (mega)fire we could get an even hotter fire (here),” Williams forewarned. “This (area) would just be an inferno.” The Gospers Mountain Fire - recorded as Australia’s biggest blaze - burned for 79 days, destroyed more than one-million hectares of land and 100 plus homes. It also sparked dangerous backburns that broke containment lines multiplying the catastrophe. The VFFA President is frustrated by what he perceives to be too few hazard reduction burns. Approvals could also take two years to be signed off from authorities which wrapped local crews in “red and green tape,” he said. He blamed a “28-page bushfire environmental code” that restricted the ability of teams to implement cooler indigenous style burns which minimised dangers to the community and bush. “The rules and regulations are destroying the environment.” “For the last 20 years we have only managed to burn less than one percent of our bushfire prone lands.” It’s a situation he believed was playing out across the state. “The fuel loads are increasing … It’s only going to get worse.” The State’s Rural Fire Service Commissioner, Rob Rogers, though rejected suggestion hazard reduction clearances needed to be drastically increased. “We should be doing as much as we possibly can,” he said. “(but) It’s impossible to burn the amount you would need to cover the amount of vegetation we have in the state.” “Every time we do a hazard reduction in Sydney, we are inundated with people complaining about the (toxic) smoke. So, if we are suggesting that we need to increase that significantly, then there needs to be a general acceptance by the population of Sydney that they will be smoked out.” He didn’t dispute though the 300,000 hectare target was behind schedule and had been rolled over from previous wet years resulting in dangerous undergrowth. “There’s a massive amount of hazard reduction to do.” Commissioner Rogers also rejected the idea the service was “culpable” in the event a fire ravages an area listed for clearing but isn’t carried out in time. “It’s not just to do before the end of summer, it’s a 12-month target,” he said. “It’s about next summer and the summer after. It’s not just one particular period.” In terms of this fire season the state was “very prepared,” he said, having invested in resources and training. “We’ve been using that time since (2019) to be ready to refight that fire season again. But do it even better than we did last time.” Commissioner Rogers though conceded as Brian Williams had warned, many of those areas destroyed in 2019 were posing a bigger threat than expected. “I am genuinely concerned how much these fires are burning in areas that only like four years old.” Perhaps of equal concern for the RFS are figures that track a decline in volunteer numbers as crews age and move away from rural regions. Officially the service has slipped from 76,000 volunteers four years ago to 71,000 today. Sky News has been told local brigades often have far fewer volunteers available than claimed on their books. At one brigade in western-Sydney more than 60 firies were listed ‘active’ but there were only 20 on call. It is said, many, “hadn’t visited in years.” The RFS Commissioner dismissed any suggestion a proper audit should be conducted to determine how many part and fulltime crews are available in the event of a natural disaster. “The volunteers can decide their membership and tell us what it is,” he said. Volunteers who spoke to Sky News supported an audit, believing the transparency would give a truer indication of the state’s fire fighting capability and allocation of funding.",skynewsau,2023-12-12 19:00:00.000000 UTC,australia,https://www.skynews.com.au/australia-news/nsw-a-ticking-timebomb-for-catastrophic-bushfires-as-rfs-falls-significantly-behind-hazard-reduction-targets-ahead-of-summer/news-story/33e9566f0f8874318772eac74b878f11
7744c1061e8613836cb49744ac4d5b85,Woodside CEO warns regulatory risk could jeopardise future investment,"Woodside Energy’s CEO has spoken about the increasing cost of doing business in Australia, warning that the way the government responds to the company’s current projects influences future investment decisions.","Speaking to Sky News Australia’s Business Weekend on Sunday, Meg O’Neill said the energy company saw gas “playing a very important role” in Australia’s energy future, but recent court decisions had made the regulatory framework “a lot more complex”. In September a Federal Court judge ruled that the federal regulator wrongly approved Woodside’s Scarborough gas project before the company had adequately consulted a traditional custodian who was concerned seismic testing could harm her cultural heritage. This followed a similar Federal Court decision late last year that forced Santos to halt drilling on its $5.4bn Barossa gas development in the Northern Territory after it failed to consult elders from the Tiwi Islands. Ms O’Nell said Woodside was confident the company’s Scarborough development “will go ahead”, but that the government needed to change the law to ensure future projects weren’t put at risk. “We believe we have a pathway to get the approvals we need with the regulatory framework that's in place today, albeit with a lot more work and a lot more complexity,” she said. “The court rulings that happened late last year have created a huge amount of confusion not just for the industry and the regulator, but also for a lot of local communities. “We think a legislative fix is required and really that's about ensuring that everybody who's involved has clarity on what kind of consultation is appropriate.” The Woodside CEO said the company had a “large suite of opportunities” available and the board needed to make sure future investments “deliver value for our shareholders”. “One of the things that's an important consideration is the fiscal and regulatory framework,” she said. “We want to have confidence that when we spend money in a place that we will get the benefits over 10 or 20 years time.” Ms O’Neill added it was “fair to say that the risk in Australia has been increasing” and this created doubts about whether future projects would be approved. Asked by Business Weekend host Ross Greenwood how the environment in Australia compared to other countries the energy giant is investing in, the Woodside CEO said she had received a “very warm” reception from the Mexican government during a recent meeting. “It was a very warm visit. The Mexican President knew about our project very well… and (was) very supportive of Woodside's investment. “The President was super supportive and he encouraged us to look at other opportunities to invest in Mexico. So a really warm reception.” In contrast, Ms O’Nell said the reception she received from the Australian government “complicated” and “probably not as warm and fuzzy”. “Look, I think many in government understand that we just want to make sure that we have the right long-term support for the business,” the Woodside CEO said. “(But) the tone that set around investments today sends a message about appetite for investments tomorrow and that is something that we watch as an investor.”",skynewsau,2023-11-12 04:56:27.000000 UTC,australia,https://www.skynews.com.au/business/energy/woodside-ceo-meg-oneill-warns-regulatory-risk-could-put-jeopardise-future-investment-calls-for-legislative-fix-to-correct-recent-court-decisions/news-story/2e104b7660a9ca5f5e352787df0b23b1
